id	time	score	ssim_16k	ssim_160k	psnr_16k	psnr_160k	fit_s	shapes	status	desc
000	07:57:29	0.7643	0.7157	0.8128	27.67	31.43	53.2	"{""16000"": [934, 920], ""160000"": [9495, 9489]}"	keep	baseline：fit.py 原算法移植（纯 Python/numpy）
001	07:59:49	0.7636	0.7158	0.8114	27.69	31.40	2.3	"{""16000"": [940, 945], ""160000"": [9503, 9515]}"	keep	C 内核（core.c）+ 线程并行，算法参数不变
002	08:01:35	0.7754	0.7216	0.8292	28.00	32.06	13.0	"{""16000"": [938, 943], ""160000"": [9457, 9474]}"	keep	加大搜索：每个形状 4 轮×(200 候选+爬山 age100)
003	08:03:11	0.7802	0.7250	0.8353	28.13	32.27	29.8	"{""16000"": [944, 941], ""160000"": [9455, 9447]}"	keep	再加大搜索：8 轮×(300 候选+爬山 age150)
004	08:06:23	0.7802	0.7253	0.8351	28.16	32.26	30.3	"{""16000"": [940, 941], ""160000"": [9457, 9455]}"	discard	阶段 1 每个形状 12 线程并行搜索（12 轮，原来单线程 8 轮）
005	08:10:51	0.7801	0.7253	0.8349	28.16	32.24	22.3	"{""16000"": [940, 941], ""160000"": [9482, 9479]}"	keep	阶段 1 并行搜索 + 切块 24→48（线程负载更均衡）
006	08:13:55	0.7815	0.7258	0.8373	28.23	32.38	14.4	"{""16000"": [940, 937], ""160000"": [9435, 9432]}"	keep	颜色回拟合：逆序 Gauss-Seidel 3 遍（每个预算单独做）
007	08:16:29	0.7866	0.7287	0.8445	28.36	32.64	14.7	"{""16000"": [1034, 1033], ""160000"": [10666, 10666]}"	keep	编码：后两点用相对坐标 + 同一轮内按块排序
008	08:17:24	0.7882	0.7287	0.8478	28.36	32.77	11.4	"{""16000"": [1034, 1033], ""160000"": [11285, 11280]}"	keep	生成数量按新编码估算，填满 160KB（手动保留：修正预算未填满的 bug，平均分 +0.0016 略低于阈值）
009	08:19:54	0.7885	0.7288	0.8483	28.36	32.73	11.8	"{""16000"": [1043, 1040], ""160000"": [11402, 11350]}"	discard	透明度 0.5→0.6
010	08:21:03	0.7918	0.7309	0.8526	28.45	32.87	15.9	"{""16000"": [1112, 1113], ""160000"": [12305, 12324]}"	keep	颜色量化步长 4（每通道 6 位）
011	08:23:34	0.7933	0.7318	0.8548	28.47	32.90	14.7	"{""16000"": [1181, 1180], ""160000"": [13128, 13134]}"	discard	颜色量化步长 8（每通道 5 位）
012	08:24:44	0.7936	0.7325	0.8547	28.45	32.76	18.4	"{""16000"": [1282, 1280], ""160000"": [14388, 14419]}"	discard	颜色量化步长 17 + 3 位 16 进制颜色
013	08:28:21	0.7918	0.7305	0.8531	28.44	32.87	13.1	"{""16000"": [1114, 1111], ""160000"": [12824, 12810]}"	discard	颜色精度按大小分：<64 像素用 3 位颜色（步长 17），其余步长 4
014	08:30:46	0.7918	0.7309	0.8526	28.45	32.87	17.0	"{""16000"": [1112, 1113], ""160000"": [12305, 12324]}"	discard	（补丁未生效，实际是当前最好版本原样重跑：分数和形状数与 010 完全一致，说明结果可复现）
015	08:35:40	0.7967	0.7357	0.8576	28.40	32.80	15.8	"{""16000"": [1120, 1113], ""160000"": [12347, 12339]}"	keep	误差加权：RGB 误差 + 2×亮度误差²
016	08:36:54	0.7997	0.7388	0.8607	28.29	32.65	23.1	"{""16000"": [1117, 1112], ""160000"": [12348, 12356]}"	keep	亮度权重 2→5
017	08:41:21	0.8019	0.7407	0.8630	28.32	32.75	18.5	"{""16000"": [1062, 1067], ""160000"": [12287, 12295]}"	keep	几何回拟合：正向一遍，每个形状 60 次爬山（位置+颜色）
018	08:43:03	0.8042	0.7433	0.8651	28.36	32.84	34.5	"{""16000"": [1052, 1052], ""160000"": [12287, 12295]}"	keep	几何回拟合每个形状爬山 60→200 次
019	08:45:41	0.8040	0.7433	0.8647	28.37	32.82	19.5	"{""16000"": [1057, 1052], ""160000"": [12287, 12295]}"	keep	几何回拟合并行：阶段 2 按轮×块并行、两档预算并行收尾
020	08:47:54	0.8056	0.7451	0.8662	28.41	32.88	30.9	"{""16000"": [1052, 1052], ""160000"": [12287, 12295]}"	discard	几何回拟合扫 2 遍
021	08:51:59	0.8033	0.7393	0.8673	28.26	32.80	24.7	"{""16000"": [1049, 1050], ""160000"": [12284, 12291]}"	discard	SVG 加 shape-rendering=crispEdges（原判保留是打分脚本拿错了比较对象；按修正后的规则应不保留：16KB 变差、160KB 变好）
022	08:54:23	0.8034	0.7430	0.8638	28.36	32.80	25.6	"{""16000"": [1055, 1052], ""160000"": [12260, 12236]}"	discard	阶段 1 形状数 1000→2000
023	08:55:33	0.8035	0.7422	0.8648	28.33	32.82	21.7	"{""16000"": [1061, 1054], ""160000"": [12340, 12329]}"	discard	阶段 1 形状数 1000→500
024	08:58:36	0.8043	0.7441	0.8645	28.38	32.82	15.7	"{""16000"": [1036, 1039], ""160000"": [12263, 12276]}"	discard	背景改为 16 色标竖直渐变（最小二乘拟合每行平均色）
025	09:00:47	0.8037	0.7428	0.8646	28.34	32.82	22.8	"{""16000"": [1049, 1053], ""160000"": [12228, 12258]}"	discard	候选形状一半沿局部边缘方向拉长（结构张量）
026	09:02:35	0.8049	0.7434	0.8663	28.37	32.88	39.1	"{""16000"": [1058, 1052], ""160000"": [12277, 12260]}"	discard	阶段 2 每个形状搜索轮数 8→16
027	09:09:52	0.8004	0.7402	0.8605	27.92	32.15	37.2	"{""16000"": [1001, 1004], ""160000"": [11621, 11621]}"	discard	每个形状自选透明度（4 档：0.25/0.5/0.75/1，#rrggbbaa），内核重写
028	09:11:14	0.8040	0.7433	0.8647	28.37	32.82	19.1	"{""16000"": [1057, 1052], ""160000"": [12297, 12275]}"	discard	阶段 2 形状分配：按误差 70%→90%
029	09:12:22	0.8043	0.7435	0.8650	28.37	32.82	19.5	"{""16000"": [1054, 1060], ""160000"": [12283, 12281]}"	discard	爬山加小步长精修（30% 变动步长×0.25）
030	09:14:07	0.8041	0.7433	0.8648	28.37	32.82	30.9	"{""16000"": [1057, 1056], ""160000"": [12277, 12274]}"	discard	禁用太小/太细的三角形（面积<3 或最窄处<0.8 像素），减小与浏览器抗锯齿的偏差
031	10:40:19	0.8051	0.7452	0.8650	28.43	32.84	30.9	"{""16000"": [1053, 1053], ""160000"": [12284, 12296]}"	discard	阶段 1 改在全分辨率上拟合（原来半分辨率、坐标×2）
032	10:43:23	0.8039	0.7431	0.8647	28.37	32.82	20.5	"{""16000"": [1057, 1057], ""160000"": [12287, 12295]}"	discard	阶段 1 形状的几何回拟合按依赖层级并行（77 层）+ 计时埋点
033	10:54:39	0.8040	0.7433	0.8647	28.37	32.82	6.6	"{""16000"": [1057, 1052], ""160000"": [12286, 12294]}"	keep	行前缀和：搜索与几何回拟合的评估代价与面积无关（结果与原算法一致）
034	10:55:27	0.8050	0.7450	0.8650	28.42	32.84	8.6	"{""16000"": [1048, 1053], ""160000"": [12284, 12296]}"	discard	阶段 1 改在全分辨率上拟合（前缀和提速后重试）
035	11:04:18	0.8110	0.7448	0.8772	28.43	33.23	15.7	"{""16000"": [1051, 1047], ""160000"": [12158, 12137]}"	keep	覆盖率渲染模型：拟合按面积覆盖（与浏览器抗锯齿一致），内部像素前缀和、边缘逐个算
036	11:12:50	0.8082	0.7422	0.8742	28.31	33.08	19.5	"{""16000"": [975, 980], ""160000"": [11171, 11175]}"	discard	坐标网格 1/2 像素（viewBox 放大 2 倍，坐标仍为整数）
037	11:14:17	0.8126	0.7467	0.8785	28.31	33.06	20.9	"{""16000"": [1057, 1050], ""160000"": [12161, 12157]}"	discard	覆盖率模型下重调亮度权重 5→8
038	11:26:09	0.8083	0.7434	0.8732	28.35	33.07	15.8	"{""16000"": [1051, 1041], ""160000"": [12032, 12051]}"	discard	新表示：三角形 + 笔触（带宽线段）混用，按实测字节成本（13.2/12.8）比较每字节收益
039	11:38:42	0.8110	0.7448	0.8772	28.44	33.23	23.5	"{""16000"": [1056, 1052], ""160000"": [12158, 12137]}"	discard	阶段 1 形状的几何回拟合按区域依赖分层并行（区域与串行时相同，结果等价）
040	11:40:19	0.8149	0.7488	0.8810	28.36	33.17	24.8	"{""16000"": [1057, 1051], ""160000"": [12252, 12249]}"	keep	组合小改进：亮度权重 8 + 路径省略 z + 几何回拟合 2 遍
041	11:42:50	0.8160	0.7506	0.8815	28.39	33.19	21.4	"{""16000"": [1052, 1052], ""160000"": [12229, 12252]}"	discard	阶段 1 全分辨率拟合（在组合改进之上）
042	11:46:33	0.8167	0.7508	0.8826	28.42	33.26	20.5	"{""16000"": [1057, 1051], ""160000"": [12191, 12188]}"	discard	删减再补：删掉删除代价 < 0.8×最后一轮平均收益的形状，补同样数量新形状，再回拟合
043	11:47:44	0.8166	0.7506	0.8827	28.41	33.27	21.9	"{""16000"": [1052, 1051], ""160000"": [12191, 12188]}"	discard	删减再补，阈值 0.8→1.0（删得更多）
044	11:49:06	0.8175	0.7518	0.8831	28.43	33.27	25.8	"{""16000"": [1052, 1052], ""160000"": [12168, 12191]}"	keep	删减再补（0.8）+ 阶段 1 全分辨率
045	11:50:42	0.8183	0.7525	0.8841	28.45	33.32	27.9	"{""16000"": [1047, 1052], ""160000"": [12168, 12191]}"	discard	删减再补做 2 轮
046	11:53:53	0.8181	0.7521	0.8841	28.43	33.31	24.6	"{""16000"": [1061, 1061], ""160000"": [12312, 12306]}"	discard	透明度 0.5→0.6（覆盖率模型 + 删减再补之后重试）
047	11:55:12	0.8176	0.7517	0.8834	28.44	33.29	26.9	"{""16000"": [1051, 1050], ""160000"": [12155, 12163]}"	discard	阶段 2 切块数 48→24
048	14:48:08	0.8177	0.7518	0.8836	28.43	33.32	23.1	"{""16000"": [1052, 1052], ""160000"": [12176, 12180]}"	keep	修 bug：颜色量化把 255 舍入成 256，十六进制非法、浏览器画成黑色（160KB 档 12168 个里有 29 个）；加 --tiles 参数（默认 48 不变）（手动保留：修 bug，分数持平 0.8177/0.8175）
